{
  "id": "resp_s2_7f3a",
  "system": "s2.reasoning",
  "system_version": "1.0.2",
  "created_at": 1791968401,
  "status": "completed",
  "confidence": 0.9,
  "confidence_basis": "self_report",
  "cost": {
    "amount": 0.000765,
    "currency": "USD",
    "usage": {
      "input_tokens": 900,
      "output_tokens": 1350,
      "total_tokens": 2250,
      "output_tokens_details": {
        "reasoning_tokens": 1184
      }
    }
  },
  "latency_ms": 6400,
  "trace_ref": {
    "trace_id": "4bf92f3577b34da6a3ce929d0e0e4736",
    "span_id": "2b3c4d5e6f708192"
  },
  "implementation": {
    "provider": "openai",
    "model": "gpt-6-luna",
    "endpoint": "POST /v1/responses"
  },
  "metadata": {
    "ticket_id": "T-88213"
  },
  "body": {
    "note": "System-specific payload; see s2-reasoning.schema.json."
  }
}
